{
  "schema_version": 1,
  "id": "stage_demo_01",
  "enemies": [ { "hero_id": "hero_terra", "slot": 0 } ],
  "rewards": ["reward_stage_demo"],
  "max_rounds": 30,
  "basic_skill_id": "skill_sample_basic",
  "combat_rules": {
    "def_constant_k": 300,
    "min_damage": 1,
    "crit_multiplier_fixed": 1500,
    "accuracy_bp": 10000,
    "crit_rate_bp": 0,
    "energy": { "initial": 0, "on_attack": 0, "on_hit": 0, "ultimate_cost": 100, "max": 100 }
  }
}
